{
  "cases": {
    "behavior": [
      {
        "id": "focused-layout-review",
        "notes": "Human review passed every behavior assertion: the response distinguished distribution and import identities, identified discovery and checkout contamination, staged artifact verification, and made no destructive action or unverified claim.",
        "passed": true,
        "skill": "python-project-layout"
      },
      {
        "id": "end-to-end-new-library",
        "notes": "Human review passed every behavior assertion: the response covered the complete typed-library layout, data, entry point, discovery, and clean-install verification; labeled backend assumptions; and avoided undeclared dependencies and path workarounds.",
        "passed": true,
        "skill": "python-project-layout"
      },
      {
        "id": "focused-flaky-suite",
        "notes": "Human review passed every behavior assertion: the response separated database, time, and retry risks, narrowed fixture ownership, controlled time, required first-failure evidence, retained a bounded pull-request path, and did not delete tests or use retries as the remedy.",
        "passed": true,
        "skill": "python-test-architecture"
      },
      {
        "id": "end-to-end-service-strategy",
        "notes": "Human review passed every behavior assertion: the response mapped behaviors to the narrowest test levels with explicit real and fake boundaries, cleanup, determinism, CI selection, gaps, and budgets, without over-mocking or treating coverage as proof.",
        "passed": true,
        "skill": "python-test-architecture"
      },
      {
        "id": "focused-translation-review",
        "notes": "Human review passed every behavior assertion: the response supplied a stable actionable not-found contract with causal chaining, one application-owned logging boundary, and safe structured context, without catching BaseException or discarding causes.",
        "passed": true,
        "skill": "python-domain-exception-policy"
      },
      {
        "id": "end-to-end-error-policy",
        "notes": "Human review passed every behavior assertion: the response supplied a complete taxonomy, translation, cleanup, logging, and bounded idempotent retry policy; preserved cancellation and unexpected tracebacks; and avoided arbitrary retries and unsafe logging.",
        "passed": true,
        "skill": "python-domain-exception-policy"
      }
    ],
    "boundaries": [
      {
        "boundaryId": "python-cli-error-output-vs-python-domain-exception-policy",
        "boundarySkills": [
          "python-cli-error-output",
          "python-domain-exception-policy"
        ],
        "caseId": "python-cli-error-output-vs-python-domain-exception-policy-a-only",
        "expectedSkills": [
          "python-cli-error-output"
        ],
        "installedPacks": [
          "python-best-practices",
          "python-cli-apps"
        ],
        "notes": "Human review passed: the pair-isolated boundary selected the exact canonical skill set and stayed within scope; expected=[\"python-cli-error-output\"], observed=[\"python-cli-error-output\"].",
        "observedSkills": [
          "python-cli-error-output"
        ],
        "passed": true,
        "scope": "cross-pack"
      },
      {
        "boundaryId": "python-cli-error-output-vs-python-domain-exception-policy",
        "boundarySkills": [
          "python-cli-error-output",
          "python-domain-exception-policy"
        ],
        "caseId": "python-cli-error-output-vs-python-domain-exception-policy-b-only",
        "expectedSkills": [
          "python-domain-exception-policy"
        ],
        "installedPacks": [
          "python-best-practices",
          "python-cli-apps"
        ],
        "notes": "Human review passed: the pair-isolated boundary selected the exact canonical skill set and stayed within scope; expected=[\"python-domain-exception-policy\"], observed=[\"python-domain-exception-policy\"].",
        "observedSkills": [
          "python-domain-exception-policy"
        ],
        "passed": true,
        "scope": "cross-pack"
      },
      {
        "boundaryId": "python-cli-error-output-vs-python-domain-exception-policy",
        "boundarySkills": [
          "python-cli-error-output",
          "python-domain-exception-policy"
        ],
        "caseId": "python-cli-error-output-vs-python-domain-exception-policy-both",
        "expectedSkills": [
          "python-cli-error-output",
          "python-domain-exception-policy"
        ],
        "installedPacks": [
          "python-best-practices",
          "python-cli-apps"
        ],
        "notes": "Human review passed: the pair-isolated boundary selected the exact canonical skill set and stayed within scope; expected=[\"python-cli-error-output\",\"python-domain-exception-policy\"], observed=[\"python-domain-exception-policy\",\"python-cli-error-output\"].",
        "observedSkills": [
          "python-cli-error-output",
          "python-domain-exception-policy"
        ],
        "passed": true,
        "scope": "cross-pack"
      },
      {
        "boundaryId": "python-cli-error-output-vs-python-domain-exception-policy",
        "boundarySkills": [
          "python-cli-error-output",
          "python-domain-exception-policy"
        ],
        "caseId": "python-cli-error-output-vs-python-domain-exception-policy-neither",
        "expectedSkills": [],
        "installedPacks": [
          "python-best-practices",
          "python-cli-apps"
        ],
        "notes": "Human review passed: the pair-isolated boundary selected the exact canonical skill set and stayed within scope; expected=[], observed=[].",
        "observedSkills": [],
        "passed": true,
        "scope": "cross-pack"
      },
      {
        "boundaryId": "python-cli-testing-vs-python-test-architecture",
        "boundarySkills": [
          "python-cli-testing",
          "python-test-architecture"
        ],
        "caseId": "python-cli-testing-vs-python-test-architecture-a-only",
        "expectedSkills": [
          "python-cli-testing"
        ],
        "installedPacks": [
          "python-best-practices",
          "python-cli-apps"
        ],
        "notes": "Human review passed: the pair-isolated boundary selected the exact canonical skill set and stayed within scope; expected=[\"python-cli-testing\"], observed=[\"python-cli-testing\"].",
        "observedSkills": [
          "python-cli-testing"
        ],
        "passed": true,
        "scope": "cross-pack"
      },
      {
        "boundaryId": "python-cli-testing-vs-python-test-architecture",
        "boundarySkills": [
          "python-cli-testing",
          "python-test-architecture"
        ],
        "caseId": "python-cli-testing-vs-python-test-architecture-b-only",
        "expectedSkills": [
          "python-test-architecture"
        ],
        "installedPacks": [
          "python-best-practices",
          "python-cli-apps"
        ],
        "notes": "Human review passed: the pair-isolated boundary selected the exact canonical skill set and stayed within scope; expected=[\"python-test-architecture\"], observed=[\"python-test-architecture\"].",
        "observedSkills": [
          "python-test-architecture"
        ],
        "passed": true,
        "scope": "cross-pack"
      },
      {
        "boundaryId": "python-cli-testing-vs-python-test-architecture",
        "boundarySkills": [
          "python-cli-testing",
          "python-test-architecture"
        ],
        "caseId": "python-cli-testing-vs-python-test-architecture-both",
        "expectedSkills": [
          "python-cli-testing",
          "python-test-architecture"
        ],
        "installedPacks": [
          "python-best-practices",
          "python-cli-apps"
        ],
        "notes": "Human review passed: the pair-isolated boundary selected the exact canonical skill set and stayed within scope; expected=[\"python-cli-testing\",\"python-test-architecture\"], observed=[\"python-test-architecture\",\"python-cli-testing\"].",
        "observedSkills": [
          "python-cli-testing",
          "python-test-architecture"
        ],
        "passed": true,
        "scope": "cross-pack"
      },
      {
        "boundaryId": "python-cli-testing-vs-python-test-architecture",
        "boundarySkills": [
          "python-cli-testing",
          "python-test-architecture"
        ],
        "caseId": "python-cli-testing-vs-python-test-architecture-neither",
        "expectedSkills": [],
        "installedPacks": [
          "python-best-practices",
          "python-cli-apps"
        ],
        "notes": "Human review passed: the pair-isolated boundary selected the exact canonical skill set and stayed within scope; expected=[], observed=[].",
        "observedSkills": [],
        "passed": true,
        "scope": "cross-pack"
      },
      {
        "boundaryId": "python-project-layout-vs-python-test-architecture",
        "boundarySkills": [
          "python-project-layout",
          "python-test-architecture"
        ],
        "caseId": "python-project-layout-vs-python-test-architecture-a-only",
        "expectedSkills": [
          "python-project-layout"
        ],
        "installedPacks": [
          "python-best-practices"
        ],
        "notes": "Human review passed: the pair-isolated boundary selected the exact canonical skill set and stayed within scope; expected=[\"python-project-layout\"], observed=[\"python-project-layout\"].",
        "observedSkills": [
          "python-project-layout"
        ],
        "passed": true,
        "scope": "internal-pack"
      },
      {
        "boundaryId": "python-project-layout-vs-python-test-architecture",
        "boundarySkills": [
          "python-project-layout",
          "python-test-architecture"
        ],
        "caseId": "python-project-layout-vs-python-test-architecture-b-only",
        "expectedSkills": [